,Healgen Scientific LLC,COVID-19 IgG/IgM Rapid Test Cassette (Whole Blood/Serum/Plasma),,https://www.healgen.com/if-respiratory-covid-19,Kit,USA,"EUA granted May 29, 2020",Laboratory,"H, M",Serology,"IgG, IgM",Lateral Flow,"Venous whole blood, plasma from anticoagulated blood, serum",ND,NA,S (S1 region),None,Gold with visual read,Less than 10 mins,NA,,No cross-reactivity detected in wet lab testing,100.00%,30,Clinical,97.50%,80,100.00%,67.80%,,"PPA determined with 90 clinical plasma samples collected from January to mid-March 2020 at two sites in China from individual patients exhibiting COVID symptoms and confirmed positive with RT-PCR assays for SARS-CoV-2 (method not disclosed), and 30 frozen SARS-CoV-2 antibody-positive serum samples confirmed positive with a nucleic acid amplification test (NAAT) and confirmed to contain both IgM and IgG antibodies with at least one orthogonal method (methods not disclosed). Positive assay results for PPA were those that were positive for IgG or IgM. NPA determined with 101 clinical plasma (K2EDTA) samples collected from January to mid-March 2020 at two sites in China from individual patients exhibiting COVID symptoms and confirmed negative with RT-PCR assays for SARS-CoV-2 (method not disclosed), and 80 frozen SARS-CoV-2 antibody-negative serum samples collected prior to 2020 including a subset selected from banked serum from HIV+ patients (n=10). Testing was performed by one operator using one lot of the COVID-19 IgG/IgM Rapid Test Cassette (Whole Blood/Serum/Plasma). Negative assay results for PPA were those that were negative for both IgG and IgM. *Note that respiratory samples collected from sites in China were both OP swabs (site #1, n = 65) and sputum (site #2, n = 126), but association of positive and negative plasma samples to corresponding respiratory specimen types was not disclosed. Also, the time from RT-PCR result to collection of plasma specimens ranged from 15- 45 days (Site #1) and 0-38 days (Site #2) and the time from collection of specimens (plasma) from each individual to testing ranged from 12-23 days (Site #1) and 3-29 days (Site #2).",not included,included,not included,ND,https://www.fda.gov/media/138438/download,https://www.fda.gov/media/138435/download,5/28/2020 12:09,6/20/2020 7:47,,
,Abbott Molecular Inc.,Alinity m SARS-CoV-2 assay,,https://www.molecular.abbott/us/en/products/infectious-disease/alinity-m-sars-cov-2-assay,Kit,USA,"EUA granted May 11, 2020",Laboratory,H,Molecular,RNA,rRT-PCR,"Nasal swabs, nasopharyngeal (NP) and oropharyngeal (OP) swabs, bronchoalveolar lavage fluid (BAL)",Specimen Transport Buffer,"ORF1ab (RdRp region)
 N",NA,Abbott Alinity m,Abbott Alinity m,ND,100 copies/mL,,No cross-reactivity predicted in silico,100.00%,40,Contrived,100.00%,31,100.00%,100.00%,,PPA determined with contrived NP specimens spiked with SARS-CoV-2 RNA sequences. NPA determined with negative NP specimens,not included,included,included,ND,https://www.fda.gov/media/137979/download,https://www.fda.gov/media/137980/download,5/21/2020 0:47,5/21/2020 1:19,,
,1drop Inc.,1copy COVID-19 qPCR Multi Kit,,http://www.1drop.co.kr/sp.php?p=63,Kit,South Korea,"EUA granted May 11, 2020",Laboratory,H,Molecular,RNA,rRT-PCR,"Nasopharyngeal swab, anterior nasal swab, midturbinate nasal swab and oropharyngeal swab as well as nasopharyngeal wash/aspirate and
 nasal aspirate",Puritan UniTranz-RT,ORF1ab (RdRP region) E,NA,Qiagen QIAamp Viral RNA Mini Kit RNA mini kit,"Roche Light Cycler 480 with Software version 1.5, Qiagen Rotor-Gene Q 5plex HRM with Software version 2.3.4, ABI Quantstudio5 with Software version 1.4.3, ABI 7500 Real-Time PCR Instrument system with Software version 2.0.6, Bio-Rad CFX96™ Real-Time PCR Detection system with CFX Maestro version 1.1",ND,200 copies/mL,,No cross-reactivity predicted in silico nor detected in wet lab testing,100.00%,60,Contrived,100.00%,60,100.00%,100.00%,,PPA determined with contrived NP (n=30) and OP (n=30) specimens spiked with SeraCare AccuPlex™ RNA reference material. NPA determined with negative NP/OP specimens,not included,included,included,ND,https://www.fda.gov/media/137935/download,https://www.fda.gov/media/137934/download,5/21/2020 0:45,5/21/2020 1:06,,
,Quidel Corporation,Lyra Direct SARS-CoV-2 Assay,,https://www.quidel.com/molecular-diagnostics/lyra-direct-sars-cov-2-assay,Kit,USA,"EUA granted May 18, 2020",Laboratory,H,Molecular,RNA,rRT-PCR,"Nasal, nasopharyngeal, or oropharyngeal swabs",None - should not be used,ORF1ab,NA,Manual buffer addition and heating,"ABI 7500 Fast Dx, ABI 7500 Standard, Roche LightCycler 480, Roche
 Cobas Z480, Bio-Rad CFX96 Touch, Thermofisher QuantStudio 7 Pro, Qiagen Rotor-Gene Q",ND,6.8 x 10^4 copies/mL (QuantStudio) 3.40E+04 copies/mL (other platforms),,No cross-reactivity predicted in silico nor detected in wet lab testing,97.80%,45,Contrived,100.00%,38,99.88%,100.00%,,PPA determined with contrived NP (29/30) and OP (15/15) specimens spiked with virus; NPA determined with 38 NP (30) and OP (8) negative specimens,included,included,included,ND,https://www.fda.gov/media/138178/download,https://www.fda.gov/media/138179/download,5/19/2020 16:55,5/21/2020 1:03,,
,"Everlywell, Inc.",Everlywell COVID-19 Test Home Collection Kit,,https://www.everlywell.com/products/covid-19-test/,Collection,USA,"EUA granted May 15, 2020",Laboratory,NA,Home Collection Kit,RNA,NA,Nasal swab,Saline,NA,NA,NA,NA,NA,NA,,NA,,,NA,,,0.00%,0.00%,,NA - collection kit,NA,NA,NA,ND,https://www.fda.gov/media/138146/download,https://www.fda.gov/media/138144/download,5/18/2020 18:13,6/20/2020 7:48,,
,GeneMatrix,NeoPlex COVID-19 Detection Kit,,http://genematrix.net/2018/subpage.php?p=m1_2_neoplexCOVID19,Kit,South Korea,"EUA granted May 15th, 2020",Laboratory,H,Molecular,RNA,rRT-PCR,"Nasopharyngeal, oropharyngeal, midturbinate, and nasal swabs and sputum, tracheal aspirates, and
 bronchoalveolar lavage",UTM,"ORF1ab (RdRp region)
 N",NA,Qiagen QIAamp DSP Viral RNA Mini Kit,ABI 7500 Fast Dx Real-Time PCR Instrument with SDS software version 1.4,ND,50 copies/rxn,,No cross-reactivity predicted in silico,100.00%,120,Contrived,100.00%,120,100.00%,100.00%,,"PPA determined with contrived NP (n=40), OP (n=40), Sputum (n=40) specimens spiked with viral RNA extracted from positive patients. NPA determined with clinical NP (n=40), OP (n=40), Sputum (n=40) specimens confirmed negative for SARS-CoV-2 by a sequencing panel established by the Ministry of Health of Japan",not included,included,included,ND,https://www.fda.gov/media/138100/download,https://www.fda.gov/media/138101/download,5/18/2020 0:18,5/21/2020 0:47,,
,Assurance,ASSURANCE SARS-COV-2 PANEL,,https://assurancescientificlabs.com/coronavirus/,Lab,USA,"EUA granted May 15th, 2020",Laboratory,H,Molecular,RNA,rRT-PCR,"Nasal (including Everlywell home collection), nasopharyngeal or oropharyngeal swabs","Saline, Amies",E,NA,Zymo Quick-RNA Viral Kit RNA Extraction Kit with Abnova Precipitor32 or Indical Indimag 48,BioRad CFX96 or CFX384,ND,37 copies/rxn,,No cross-reactivity predicted in silico nor detected in wet lab testing,100.00%,77,Clinical and Contrived,100.00%,78,100.00%,100.00%,,"PPA determined with contrived (n=72) combined NP, OP, nasal specimens spiked with viral genomic RNA and clinical (n=5) specimens. NPA determined with negative NP, OP, nasal specimens",included,included,included,ND,https://www.fda.gov/media/138154/download,https://www.fda.gov/media/138151/download,5/17/2020 23:42,6/20/2020 7:50,,
,Fulgent Therapeutics LLC,Fulgent COVID-19 by RT-PCR Test,,https://www.fulgentgenetics.com/covid19,Lab,USA,"EUA granted May 15, 2020",Laboratory,H,Molecular,RNA,rRT-PCR,"Nasal, nasopharyngeal, and oropharyngeal
 swabs and self collected nasal swabs",Saline,N,NA,Qiagen QIAamp Viral RNA Mini Kit or Zymo QuickRNA Viral Kit RNA Extraction Kits,QuantStudio 6 or QuantStudio 7 realtime PCR systems,1 - 2 days (from receiving sample),5 copies/µL,,No cross-reactivity predicted in silico,100.00%,30,Clinical,100.00%,64,100.00%,100.00%,,"PPA determined with 30 clinical NP, OP and mid-turbinate swab specimens that tested positive with an EUA molecular test. NPA determined with 64 negative NP, OP and mid-turbinate swab specimens",ND,included,included,ND,https://www.fda.gov/media/138150/download,https://www.fda.gov/media/138147/download,5/17/2020 21:05,5/21/2020 1:22,,
,"Hologic, Inc",Aptima SARS-CoV-2 assay,,https://www.hologic.com/coronavirus-test,Kit,USA,"EUA granted May 14, 2020",Laboratory,H,Molecular,RNA,rRT-PCR,"Nasopharyngeal (NP), nasal, mid-turbinate and oropharyngeal (OP) swab specimens",VTM/UTM,ORF1ab,NA,Hologic Panther or Panther Fusion Systems,Hologic Panther or Panther Fusion Systems,2.4 hours,0.01 TCID50/mL,,No cross-reactivity predicted in silico nor detected in wet lab testing,100.00%,50,Clinical,98.20%,54,100.00%,74.52%,,PPA/NPA determined using remnant clinical NP specimens vs Panther Fusion system as reference method.,not included,included,included,ND,https://www.fda.gov/media/138096/download,https://www.fda.gov/media/138097/download,5/17/2020 20:34,5/25/2020 8:42,,
,Rutgers Clinical Genomics Laboratory-Rutgers University copy,ThermoFisher - Applied Biosystems TaqPath COVID-19 Combo Kit,,https://www.rutgers.edu/news/rutgers-launches-genetic-testing-service-new-coronavirus,Lab,USA,"EUA granted Apr 10, 2020",Laboratory,H,Molecular,RNA,rRT-PCR,"Oropharyngeal swab, nasopharyngeal swab, anterior nasal swab, mid-turbinate nasal swab and saliva","VTM; Spectrum Solutions LLC SDNA-1000
 Saliva Collection Device (saliva only)","ORF1ab
 N
 S",NA,Qiagen QIAamp® DSP Viral RNA Mini Kit,ABI 7500 Fast Dx Real-Time PCR Instrument,under 3 hours,200 copies/mL,,No cross-reactivity predicted in silico,100.00%,60,Clinical and Contrived,100.00%,60,100.00%,100.00%,,PPA determined with 30 contrived clinical NP specimens spiked with SARS-CoV-2 in vitro transcripts (Exact Diagnostics); another 30 prospective clinical saliva specimens were compared to NP (n=26) and OP (n=4) samples. NPA determined with 30 contrived NP specimens spiked with human gDNA (Exact Diagnostics) and 30 prospective clinical saliva specimens compared to NP (n=27) and OP (n=3).,included,included,included,ND,https://www.fda.gov/media/136875/download,https://www.fda.gov/media/136876/download,5/13/2020 17:00,5/14/2020 18:38,,
,"Biocollections Worldwide, Inc.",Biocollections Worldwide SARS-Co-V-2 Assay,,http://www.biocollections.com/,Lab,USA,"EUA granted on May 07, 2020",Laboratory,H,Molecular,RNA,rRT-PCR,"Nasal swab,
 nasopharyngeal swab, oropharyngeal swab, nasopharyngeal wash/aspirate or nasal
 aspirate, bronchoalveolar lavage",VTM,N,NA,Abbott m2000 system m2000sp (software version 8.1.8.0),Abbott m2000 system m2000rt (software version 8.1.8.0),ND,1 copy/μL,,No cross-reactivity predicted in silico,100.00%,35,Clinical,100.00%,35,100.00%,100.00%,,PPA determined with clinical NP (n=32) and OP (n=3) specimens (source not disclosed) each assessed for agreement with a positive result from an FDA-authorized EUA test. NPA determined with clinical NP (n=25) and OP (n=10) specimens (source not disclosed) each assessed for agreement with a negative result from an FDA-authorized EUA test. Tests conducted in blinded fashion.,not included,included,included,ND,https://www.fda.gov/media/137897/download,https://www.fda.gov/media/137896/download,5/12/2020 21:49,5/25/2020 9:05,,
,BioMérieux SA,SARS-COV-2 R-GENE,,https://www.biomerieux-diagnostics.com/sars-cov-2-r-gene,Kit,France,"EUA granted on May 06, 2020",Laboratory,H,Molecular,RNA,rRT-PCR,"Nasopharyngeal swab, oropharyngeal swab, anterior nasal swab, mid-turbinate nasal swab, nasal aspirate, nasal wash and bronchoalveolar lavage",UTM,"ORF1ab (RdRp region)
 N",NA,"bioMérieux EMAG® (with software version 1.1),
 bioMérieux NucliSENS easyMAG (with software version 2.1),
 QIAgen QIASymphony SP (with software version 4.1),
 Roche MagNA Pure 96 (with software version 3.1)","ABI 7500 Fast(1) (with software version 2.3),
 ABI 7500 Fast Dx(1) (with software version 1.4.), ABI QuantStudio 5 Dx(1) (with software version 1.0), Roche LightCycler 480 (System II) (with software version 1.5), Bio-Rad CFX96 (with software Maestro 1.1), Qiagen Rotor‑Gene Q (with software 2.3)",ND,0.43 TCID 50/mL (380 genomic copies/mL),,No cross-reactivity predicted in silico nor detected in wet lab testing,100.00%,50,Contrived,100.00%,76,100.00%,100.00%,,"PPA determined with 50 contrived clinical NP specimens in UTM spiked with inactivated SARS‑CoV‑2 (source not disclosed). NPA determined with 76 contrived clinical NP specimens (source not disclosed). All samples were extracted with the EMAG® instrument, following the B31 extraction method protocol
 then amplified on the Applied Biosystems 7500 Fast Dx",not included,included,included,ND,https://www.fda.gov/media/137742/download,https://www.fda.gov/media/137743/download,5/12/2020 21:49,5/25/2020 8:44,,
,Fast Track Diagnostics Luxembourg S.á.r.l. (a Siemens Healthineers Company),FTD SARS-CoV-2,,http://www.fast-trackdiagnostics.com/human-line/products/ftd-sars-cov-2/,Kit,Luxembourg,"EUA granted on May 05, 2020",Laboratory,H,Molecular,RNA,rRT-PCR,"Nasal swab, nasopharyngeal swab, oropharyngeal swab, nasopharyngeal wash/aspirate or nasal aspirate), Bronchoalveolar lavage (BAL)",VTM,"ORF1ab
 N",NA,bioMérieux NucliSENS® easyMAG® (software version not specified),Applied Biosystems® 7500 Real-Time PCR System (software version not specified),ND,0.0023 TCID50/mL,,No cross-reactivity predicted in silico nor detected in wet lab testing,100.00%,44,Clinical,100.00%,30,100.00%,100.00%,,PPA determined with 44 clinical NP specimens (source not disclosed) each assessed for agreement with a positive result from FDA-authorized RT-PCR test. NPA determined with 36 clinical NP specimens (source not disclosed) each assessed for agreement with a negative result from FDA-authorized RT-PCR test. *Note that 1 negative sample was excluded due to protocol deviation and 5 negative samples did not pass criteria for a valid run (internal control failure).,not included,included,included,ND,https://www.fda.gov/media/137690/download,https://www.fda.gov/media/137687/download,5/12/2020 21:49,5/21/2020 0:54,,
,"OPTI Medical Systems, Inc.",OPTI SARS-CoV-2 RT PCR Test,,https://www.optimedical.com/products-services/C19-test.html,Kit,USA,"EUA granted on May 06, 2020",Laboratory,H,Molecular,RNA,rRT-PCR,"Nasal swab, nasopharyngeal swab, oropharyngeal swab, sputum, lower respiratory tract aspirates, bronchoalveolar lavage, and nasopharyngeal wash/aspirate or nasal aspirate",VTM,N (N1 and N2 regions),NA,IDEXX RealPCR DNA/RNA Magnetic Bead Kit on the ABI/ThermoFisher KingFisher™ Flex; Machery-Nagel NucleoMag VET Magnetic Extraction Kit on the ABI/ThermoFisher KingFisher™ Duo Prime,"Applied Biosystems® 7500 FAST
 PCR instrument (software v2.0.6), Applied Biosystems® QuantStudio 5 (software v1.5.1), Agilent Mx3005P (MxPro qPCR software v4.10), Bio Molecular Systems Mic qPCR (micPCR software v2.8.10), Roche LightCycler® 480 (with LightCycler 480 SW software v1.5.1)",ND,"0.7 copies/μL (sputum), 0.9 copies/μL (NP swabs)",,No cross-reactivity predicted in silico,100.00%,60,Contrived,100.00%,60,100.00%,100.00%,,"PPA determined with contrived clinical NP (n=30) and sputum (n=30) specimens collected and stored prior to 2020, confirmed negative and then spiked with SARS-CoV-2 RNA (Twist Bioscience part# MT007544.1). NPA determined with clinical NP (n=30) and sputum (n=30) specimens collected and stored prior to 2020.",not included,included,included,ND,https://www.fda.gov/media/137739/download,https://www.fda.gov/media/137737/download,5/12/2020 21:49,5/25/2020 8:48,,
,Sansure BioTech Inc.,Novel Coronavirus (2019-nCoV) Nucleic Acid Diagnostic Kit (PCR-Fluorescence Probing),,http://eng.sansure.com.cn/index.php?g=portal&m=article&a=index&id=81,Kit,China,"EUA granted on May 04, 2020",Laboratory,H,Molecular,RNA,rRT-PCR,"Nasopharyngeal swab, oropharyngeal (throat) swab, anterior nasal swab, midturbinate swab, nasal wash, nasal aspirate",Sample Storage Reagent (Use Qiagen QIAamp Viral RNA Mini Kit for samples in VTM/UTM),ORF1ab N,NA,"One step centrifugation and lysis, then sample directly added to master mix using QIAamp Viral RNA Mini Kit",ABI 7500 Real-Time PCR System (software v1.5),ND,200 copies/mL,,No cross-reactivity predicted in silico nor detected in wet lab testing,94.30%,53,Clinical,99.00%,193,99.70%,82.68%,,"PPA determined with 53 clinical OP specimens in Sample Storage Reagent (source not disclosed) each assessed for agreement with a positive result from Real-Time Fluorescent RT-PCR kit for Detecting SARS-2019-nCoV from BGI Genomics. NPA determined with 193 clinical OP specimens (source not disclosed) each assessed for agreement with a negative result from from Real-Time Fluorescent RT-PCR kit for Detecting SARS-2019-nCoV from BGI Genomics. In both positive and negative cases, tests run with assay being evaluated used the Sample Release Reagent RNA extraction while BGI Genomics comparator assay extraction method was the Qiagen QIAamp Viral RNA Mini Kit.",not included,included,included,ND,https://www.fda.gov/media/137651/download,https://www.fda.gov/media/137652/download,5/12/2020 21:49,5/20/2020 23:56,,
,"Sherlock BioSciences, Inc.",Sherlock CRISPR SARS-CoV-2 Kit,,https://sherlock.bio/sherlock-biosciences-receives-fda-emergency-use-authorization-for-crispr-sars-cov-2-rapid-diagnostic/,Kit,USA,"EUA granted on May 06, 2020",Laboratory,H,Molecular,RNA,RT-LAMP,"Nasal swab, nasopharyngeal swab,
 oropharyngeal swab, nasopharyngeal wash/aspirate or nasal aspirate and bronchoalveolar lavage","VTM, UTM, M4RT","ORF1ab
 N",NA,ThermoFisher PureLink Viral RNA/DNA Mini Kit,Biotek Plate Reader running Gen5 3.08 software,~1 hr,6.75 copies/μL,,No cross-reactivity predicted in silico nor detected in wet lab testing,100.00%,30,Contrived,100.00%,30,100.00%,100.00%,,"PPA determined with 30 contrived clinical NP specimens collected and stored during 2018-2019 flu season, confirmed negative and then spiked with SARS-CoV-2 viral genomic RNA (source not disclosed). NPA determined with 30 contrived clinical NP specimens collected and stored during 2018-2019 flu season and confirmed negative.",not included,included,included,ND,https://www.fda.gov/media/137746/download,https://www.fda.gov/media/137747/download,5/12/2020 21:49,6/11/2020 11:59,,
,UTMG Pathology Laboratory,UTHSC/UCH SARS-CoV-2-RT-PCR Assay,,https://www.utmedicalcenter.org/covid-19-information/,Lab,USA,"EUA granted on May 03, 2020",Laboratory,H,Molecular,RNA,rRT-PCR,"Nasal, nasopharyngeal swab",VTM,N (N1 and N2 regions),NA,Promega Maxwell RSC (software version not specified); Tecan Genesis LH platform,AriaMx Real Time PCR system and Aria software (version not specified),ND,100 PFUs,,No cross-reactivity detected in wet lab testing,96.70%,30,Contrived,100.00%,30,99.83%,100.00%,,PPA determined with 30 contrived clinical nasal specimens spiked with SARS-Related Coronavirus 2 Isolate USA- WAl/2020 (Catalog # NR-52281) viral cell supernatant. NPA determined with 30 NP nasal specimens (source and method not disclosed). Also confirmed 4/5 positive samples and 5 negative samples from above evaluation with Roche cobas SARSCoV-2. A separate analysis not included for PPA or NPA involved 10 positive and 10 negative blinded remnant swabs in VTM tested comparatively against the Roche cobas SARS-CoV-2.,not included,included,included,ND,https://www.fda.gov/media/137656/download,https://www.fda.gov/media/137654/download,5/12/2020 21:49,5/25/2020 8:51,,
,Zymo Research Corporation,Quick SARS-CoV-2rRT-PCR Kit,,https://www.zymoresearch.com/products/quick-sars-cov-2-rrt-pcr-kit,Kit,USA,"EUA granted on May 07, 2020; amended on May 18, 2020",Laboratory,H,Molecular,RNA,rRT-PCR,"Nasal swab, nasopharyngeal swag, mid-turbinate nasal swab, oropharyngeal swab, sputum, tracheal aspirates, and bronchoalveolar lavage",ND,N,NA,Zymo Quick-DNA/RNA Viral MagBead extraction kit either manually or on the automated ABI/ThermoFisher KingFisher™ Flex Purification System,Bio-Rad CFX96 Touch Real-Time PCR Detection System using the Bio-Rad CFX Maestro™ 1.1 Version 4.1.2433.1219 software,ND,83 GEC/ml (5 GEC/rxn),,"≥80% homology in silico found for Streptococus pneumoniae, Mycoplasma pneumoniae, Legionella longbeachae,
 and Neisseria meningitidis. Follow up wet lab testing with 1 x 10^6
 cells/sample specimens of these as well Pseudomonas aeruginosa and Candida albicans found 0/3 samples tested positive in all cases.",100.00%,30,Contrived,100.00%,30,100.00%,100.00%,,"PPA determined with 30 contrived clinical sputum specimens collected with DNA/RNA
 Shield™ Saliva Collection Kit and spiked with whole genome SARS-CoV-2 RNA (source not disclosed). NPA determined with clinical sputum (n=21) and OP (n=9) specimens collected from patients experiencing one or more symptoms of respiratory infection under supervision of a healthcare provider, using the DNA/RNA Shield™ Saliva Collection Kit and the DNA/RNA Shield™ Swab Collection Kit, respectively.",not included,included,included,ND,https://www.fda.gov/media/137780/download,https://www.fda.gov/media/137781/download,5/12/2020 21:49,6/1/2020 0:06,,
,Rutgers Clinical Genomics Laboratory at RUCDR Infinite Biologics - Rutgers University,Rutgers Clinical Genomics Laboratory TaqPath SARS-CoV-2-Assay,,https://www.rutgers.edu/news/fda-approves-first-home-saliva-collection-test-coronaviruest,Lab,USA,"EUA granted on May 07, 2020",Laboratory,H,Molecular,RNA,rRT-PCR,"Oropharyngeal (throat) swab, nasopharyngeal swab, anterior nasal swab, mid-turbinate nasal swab, and bronchoalveolar lavage (BAL) fluid, saliva","VTM; Spectrum Solutions
 LLC SDNA-1000 Saliva Collection Device (saliva only, including home collection)","ORF1ab
 N
 S",NA,"Chemagic Viral DNA/RNA 300 Kit H96 on the PerkinElmer Chemagic 360
 automated specimen processing system","Applied Biosystems QuantStudio 5 Real-Time PCR System equipped with
 software v1.3",ND,200 copies/mL,,No cross-reactivity predicted in silico,100.00%,65,Clinical and Contrived,100.00%,65,100.00%,100.00%,,"PPA determined with 30 contrived clinical NP specimens spiked with SARS-CoV-2 in vitro transcripts or human DNA (Exact Diagnostics); another 30 prospective clinical saliva specimens were compared to NP (n=26) and OP (n=4) samples. 5 clinical NP samples were run comparatively with both this test and CDC 2019-Novel Coronavirus (2019-nCoV) Real-Time RT-PCR Diagnostic for agreement. Simulated saliva shipping study used residual clinical saliva samples that had already tested positive with Rutgers TaqPath SARS-CoV-2 Assay Panel that were re-tested after simulated summer (n=30), winter (n=30), and control (n=30) temperature cycles. NPA determined with 30 contrived clinical NP specimens spiked with in vitro transcripts or human DNA (Exact Diagnostics) and 30 prospective clinical saliva specimens compared to NP (n=27) and OP (n=3). 5 clinical NP samples were run comparatively with both this test and CDC 2019-Novel Coronavirus (2019-nCoV) Real-Time RT-PCR Diagnostic for agreement. Simulated saliva shipping study used residual clinical saliva samples that had already tested negative with Rutgers TaqPath SARS-CoV-2 Assay Panel that were re-tested after simulated summer (n=10), winter (n=10), and control (n=10) temperature cycles.",not included,included,included,ND,https://www.fda.gov/media/137782/download,https://www.fda.gov/media/137773/download,5/11/2020 23:38,5/21/2020 0:55,,
,Gnomegen LLC,Gnomegen COVID-19-RT-qPCR Detection Kit,,https://gnomegendx.com/,Kit,USA,"EUA granted on May 08, 2020",Laboratory,H,Molecular,RNA,rRT-PCR,Nasopharyngeal and nasal swab,VTM,N (N1 and N2 regions),NA,Qiagen QIAamp DSP virus kit,"7500 Fast
 Dx Real-Time PCR Instrument (SDS version 1.4)",ND,10 copies/rxn (20µL),,No cross-reactivity predicted in silico,100.00%,60,Clinical and Contrived,100.00%,30,100.00%,100.00%,,"PPA determined with upper respiratory specimens (n=30) positive with another EUA test, and contrived upper respiratory specimens (n=30) spiked with purified whole viral RNA (COV20851-2). NPA determined with 30 negative upper respiratory specimens.",not included,included,included,ND,https://www.fda.gov/media/137895/download,https://www.fda.gov/media/137892/download,5/11/2020 23:37,5/21/2020 0:54,,
,Quidel Corporation,Sofia 2 SARS Antigen FIA,,https://ir.quidel.com/news/news-release-details/2020/Quidel-Receives-Emergency-Authorization-for-Rapid-Antigen-COVID-19-Diagnostic-Assay/default.aspx,Kit,USA,"EUA granted on May 08, 2020","Laboratory, POC","H, M, W",Antigen,Antigen,Lateral Flow,Nasopharyngeal and nasal swab,UTM,NA,N (SARS-CoV and SARS-CoV-2),Manual,Sofia 2,15 min,113 TCID50/mL (swab) 850 TCID50/mL (UTM),,No cross-reactivity detected in wet lab testing,79.70%,64,Clinical,100.00%,127,98.94%,100.00%,,PPA determined with frozen NP in UTM (47/59) and fresh NS (4/5) and NPA determined with NP (n=84) and NS (n=43) compared to EUA PCR-tested clinical specimens,not included,included,not included,ND,https://www.fda.gov/media/137885/download,https://www.fda.gov/media/137886/download,5/11/2020 22:04,5/29/2020 23:28,,
