,"Roche Molecular Systems, Inc.",cobas SARS-CoV-2 & Influenza A/B,,https://diagnostics.roche.com/global/en/products/params/cobas-sars-cov-2-influenza-a-b-test.html,Kit,USA,"EUA granted September 3, 2020",Laboratory,"H, M",Molecular,RNA,rRT-PCR,"NP swab, Ns swab","NP swab: Copan Universal Transport Medium System (UTM -RT), BD Universal Viral Transport System (UVT)
Ns swab: cobas PCR Media, saline","Sars-CoV-2: ORF1ab, E
Influenza A: M1, M2
Influenza B: NEP, NS1",NA,"Roche cobas 6800 System (software version not disclosed), Roche cobas 8800 System (software version not disclosed)","Roche cobas 6800 System (software version not disclosed), Roche cobas 8800 System (software version not disclosed)",<3.5 hours after sample loading,"0.058 TCID50/mL of single formulated USA-WA1/2020 heat-inactivated Cat No 0810587CFHI Lot 324045
0.12  TCID50/mL of USA-WA1/2020 heat-inactivated Cat No 0810587CFHI Lot 324045 co-formulated with Influenza A and Influenza B strains (unspecified)
0.0079 TCID50/mL of USA-WA1/2020 infectious culture Cat No NR-52281 Lot 70033175* co-formulated with Influenza A and Influenza B strains (unspecified) ",,No cross-reactivity predicted in silico nor detected in wet lab testing,96.40%,55,Clinical,98.00%,293,,,"PPA determined with 55 clinical positive archived NP swabs collected from patients with signs and symptoms of a respiratory infection in UTMRT or UVT (number of each media type not disclosed) at an undisclosed external site (positive determination made with the Roche cobas SARS-CoV-2 assay on the cobas Liat System). 
NPA determined with 293 clinical negative archived NP swabs collected from patients with signs and symptoms of a respiratory infection in UTMRT or UVT (number of each media type not disclosed) at an undisclosed external site (negative determination made with the Roche cobas SARS-CoV-2 assay on the cobas Liat System).
Roche instrument used for detection not disclosed.  Note that a total of 349 NP samples were collected, including 57 longitudinal samples from COVID-19 patients.  Samples were also evaluated for either Influenza A (60/60 positive agreement, 283/284 negative agreement) or Influenza B (37/37 positive agreement, 306/307 negative agreement) using the Influenza A/B & RSV on the cobas®Liat®System as a comparator.  ",not included,included,not included,ND,https://www.fda.gov/media/141887/download,https://www.fda.gov/media/141884/download,,,,,ALG
,"Sugentech, Inc.",SGTi-flex COVID-19 IgG ,,https://sugentech.com/products/products-view.php?ct=7&target=36,Kit,South Korea,"EUA granted September 3, 2020",Laboratory,"H, M",Serology,IgG,Lateral Flow,"Ser, Pla, VWB","sodium heparin, lithium heparin, sodium
citrate and tripotassium EDTA",NA,"N, S (RBD)",Manual,Gold with visual read,10 minutes after sample loading,NA,,No cross-reactivity detected in wet lab testing,96.70%,30,Clinical,100.00%,80,,,"PPA determined with 30 frozen SARS-CoV-2 antibody-positive serum samples confirmed positive with a nucleic acid amplification test (NAAT) and confirmed to contain both IgM and IgG antibodies with at least one orthogonal method (methods not disclosed) tested at the Frederick National Laboratory for Cancer Research (FNLCR).  
NPA determined with 80 frozen SARS-CoV-2 antibody-negative serum and anticoagulant citrate dextrose plasma samples (number of each sample type not disclosed) collected prior to 2020 including a subset selected from banked serum from HIV+ patients (n=10). Testing was performed by one operator using 1 lot of SGTi-flex COVID-19 IgG.
Sugentech also conducted a clinical agreement study with 419 specimens (specimen type and provenance not disclosed) with positive agreement of 95% (171/185 positive for IgG) and negative agreement of 99.15% (232/234 negative for IgG).  Results from positive samples in the latter study were further stratified into days post symptom onset.",not included,included,not included,ND,https://www.fda.gov/media/141891/download,https://www.fda.gov/media/141888/download,,,,,
,"Abbott Diagnostics Scarborough, Inc.",BinaxNOW COVID-19 Ag Card,,https://www.abbott.com/BinaxNOW-Test-NAVICA-App.html,Kit,USA,"EUA granted August 26, 2020","Laboratory, POC","H, M, W",Antigen,Antigen,Lateral Flow,Ns swab,not recommended,NA,N,Abbott Laboratories Extraction Reagent,visual read,15 minutes after sample loading,22.5 TCID50/Swab,,No cross-reactivity predicted in silico nor detected in wet lab testing,97.10%,35,Clinical,98.50%,67,,,"PPA determined with 35 clinical positive Ns specimens collected from symptomatic individuals presenting within 7 days of symptom onset with suspected COVID-19 at one of seven investigational sites throughout the U.S. (comparative positive determination conducted on a separate set of patient-matched Ns specimens collected concurrently into VTM and tested with an undisclosed FDA Emergency Use Authorized real-time Polymerase Chain Reaction (RT-PCR) assay at an undisclosed central laboratory). Positive results were also stratified by patient age, comparator method cycle threshold counts, and as cumulative test results each day post symptom onset up to 7 days.  
NPA determined with 67 clinical negative Ns specimens collected from symptomatic individuals presenting within 7 days of symptom onset with suspected COVID-19 at one of seven investigational sites throughout the U.S. (comparative negative determination conducted on a separate set of patient-matched Ns specimens collected concurrently into VTM and tested with an undisclosed FDA Emergency Use Authorized real-time Polymerase Chain Reaction (RT-PCR) assay at an undisclosed central laboratory).
Testing was performed by operators with no laboratory experience and who are representative of the intended users at CLIA waived testing sites. In this study testing was conducted by thirty-two (32) intended users. No training on the use of the test was provided to the operators.
",included,included,included,ND,https://www.fda.gov/media/141570/download,https://www.fda.gov/media/141567/download,,,,,
,Cuur Diagnostics,Cuur Diagnostics SARS-CoV-2 Molecular Assay,,https://cuurdiagnostics.com/,Lab,USA,"EUA granted August 26, 2020",Laboratory,H,Molecular,RNA,rRT-PCR,"NP swab, OP swab, MTNs swab, Ns swab",BD Universal Viral Transport Media,"N, S, ORF1ab",NA,ThermoFisher MagMAX Viral/Pathogen Nucleic Acid Isolation Kit on the ThermoFisher KingFisher Flex,ABI QuantStudio 12K Flex Real-Time PCR System (software version 1.4),Typically 24 -48 hours for result from lab,25 copies/uL,,No cross-reactivity predicted in silico,96.00%,50,Clinical,100.00%,50,,,"PPA determined with 
1) 20 clinical positive NP specimens collected from patients suspected of COVID-19 (positive determination made with an undisclosed FDA emergency use authorized SARS-CoV-2 molecular test at an undisclosed laboratory). 
2) 30 clinical positive NP specimens collected from patients suspected of COVID-19 (positive determination made with a second undisclosed FDA emergency use authorized SARS-CoV-2 molecular test at a second undisclosed laboratory).

NPA determined with 
1) 20 clinical negatve NP specimens collected from patients suspected of COVID-19 (negative determination made with an undisclosed FDA emergency use authorized SARS-CoV-2 molecular test at an undisclosed laboratory). 
2) 30 clinical negative NP specimens collected from patients suspected of COVID-19 (negatve determination made with a second undisclosed FDA emergency use authorized SARS-CoV-2 molecular test at a second undisclosed laboratory).",included,included,included,ND,https://www.fda.gov/media/141627/download,https://www.fda.gov/media/141624/download,,,,,
,QDx Pathology Services,QDX SARS-CoV-2 Assay,,https://qdxpath.com/qdx-granted-fda-emergency-use-authorization/,Lab,USA,"EUA granted August 25, 2020",Laboratory,H,Home Collection,RNA,rRT-PCR,Ns swab,Buffered Saline Solution,NA,NA,NA,NA,NA,NA,,NA,NA,NA,NA,NA,NA,,,NA - Home collection kit,NA,NA,NA,ND,https://www.fda.gov/media/141545/download,https://www.fda.gov/media/141542/download,,,,,
,Fluidigm Corporation,Advanta Dx SARS-CoV-2 RT-PCR Assay,,https://www.fluidigm.com/singlearticles/covid-19-diagnostics,Kit,USA,"EUA granted August 25, 2020",Laboratory,H,Molecular,RNA,rRT-PCR,Sal,ND,"N(N1, N2)",NA,"ABI Veriti 96-Well Thermal Cycler for reverse transcription, Fluidigm Advanta Dx 192.24 IFC on the Fluidigm Juno system (software version 3.14.1) for sample processing, Fluidigm Advanta Dx 192.24 IFC on the Fluidigm IFC Controller RX (RX Controller) (software version 2.8) for sample processing",Fluidigm Biomark HD system with (software version 4.5.2),ND,6.25 GE/uL,,No cross-reactivity predicted in silico nor detected in wet lab testing,100.00%,43,Clinical,100.00%,34,,,"PPA determined with 43 blinded clinical positive saliva specimens collected at an undisclosed clinical site (positive determination made with a matched NP sepcimen tested using an undisclosed FDA EUA SARS-Cov-2 Real-Time PCR tests authorized for use with NP swabs). 
NPA determined with 34 blinded clinical negative saliva specimens collected at an undisclosed clinical site (negative determination made with a matched NP sepcimen tested using an undisclosed FDA EUA SARS-Cov-2 Real-Time PCR tests authorized for use with NP swabs). ",not included,included,not included,ND,https://www.fda.gov/media/141541/download,https://www.fda.gov/media/141538/download,,,,,
,Biocan Diagnostics Inc.,Tell Me Fast Novel Coronavirus (COVID-19) IgG/IgM Antibody Test,,https://www.rapidtest.ca/products/tell-me-fast-novel-coronavirus-covid19-igg-igm-antibody-test-us-fda-eua/,Kit,Canada,"EUA granted August 25, 2020",Laboratory,"H, M",Serology,IgM/IgG,Lateral Flow,"Ser, Pla, VWB","Plasma: Lithium-Heparin, Sodium-Citrate, Acid Citrate Dextrose
VWB: Lithium-Heparin, Sodium-Citrate, Dipotassium-EDTA",NA,ND,manual,gold with visual read,10-15 minutes after sample addition,NA,,1/161 known negative samples (sample type not disclosed) collected in the United States prior to December 2019 with high rates of vaccination tested positive for IgG with assay under evaluation,93.30%,30,Clinical,96.20%,79,99.60%,55.40%,"PPA determined with 30 frozen SARS-CoV-2 antibody-positive serum samples confirmed positive with a nucleic acid amplification test (NAAT) and confirmed to contain both IgM and IgG antibodies with at least one orthogonal method (methods not disclosed) tested at the Frederick National Laboratory for Cancer Research (FNLCR). Positive assay results for PPA were those that were positive for IgG or IgM.  NPA determined with 80 frozen SARS-CoV-2 antibody-negative serum and plasma samples (number of each sample type not disclosed) collected prior to 2020 including a subset selected from banked serum from HIV+ patients (n=10). Negative assay results for NPA were those that were negative for both IgG and IgM. Biocan also conducted a clinical agreement study with 233 retrospective serum samples
all collected in the United States from hospital facilities or plasma centers with positive agreement of 100% (72/72 positive for IgM or IgG) and negative agreement of 99.4% (160/161 negative for both IgM and IgG).",not included,included,not included,ND,https://www.fda.gov/media/141550/download,https://www.fda.gov/media/141547/download,,,,,
,"Texas Department of State Health Services, Laboratory Services Section",Texas Department of State Health Services (DSHS) SARS-CoV-2 Assay,,https://dshs.texas.gov/lab/default.shtm,Lab,USA,"EUA granted August 21, 2020",Laboratory,H,Molecular,RNA,rRT-PCR,"NP swab, OP swab, ANs swab, MTNs swab, Ns aspirate, Ns wash, BAL",ND,"N, ORF1ab",NA,"PerkinElmer Chemagic Viral DNA/RNA 300 Kit H96 on the PerkinElmer Chemagic 360 (software version 6.3.0.3) for extraction, PerkinElmer Janus G3 Automated Workstation (software version 5.5.48.0) for pipetting",ABI 7500 Fast Dx Real-Time PCR System (software version 1.4),ND,"20 copies/mL (VTM, Liquid Amies Medium, Saline)",,No cross-reactivity predicted in silico,100.00%,40,Clincal and contrived,100.00%,41,,,"PPA determined with 
1) contrived clinical specimens consisting of 12 individual negative NP swabs (specimen provenance and method of negative determination not disclosed) in VTM (n = 5), UTM (n = 3) or liquid Amies (n = 
 4) spiked with PerkinElmer nCoV Positive Control bacteriophage-packed RNA, 
2) contrived clinical specimens consisting of 11 individual negative OP swabs (specimen provenance and method of negative determination not disclosed) in VTM (n = 5) or UTM (n = 6) spiked with PerkinElmer nCoV Positive Control bacteriophage-packed RNA, 
3) a contrived clinical specimens consisting of 1 individual negative Ns swab (specimen provenance and method of negative determination not disclosed) in VTM spiked with PerkinElmer nCoV Positive Control bacteriophage-packed RNA, 
4) 7 positive clinical NP sepcimens in either VTM (n = 4) or UTM (n = 3) (sample provenance not disclosed, positive determination with Centers for Disease Control and Prevention (CDC) 2019-Novel Coronavirus (2019-nCoV) Diagnostic Panel), 
5) 3 positive clinical OP sepcimens in either VTM (n = 2) or UTM (n = 1) (sample provenance not disclosed, positive determination with CDC 2019-nCoV Diagnostic Panel), 
6) 1 positive clinical NP/OP sepcimen in VTM (sample provenance not disclosed, positive determination with CDC 2019-nCoV Diagnostic Panel), and 
7) 5 positive clinical NP specimens in either VTM (n = 2) or liquid Amies (n = 3) (sample provenance not disclosed, positive determination with CDC 2019-nCoV Diagnostic Panel).

NPA determined with 
1) 21 negative clinical NP specimens in either VTM (n = 8), UTM (n = 8) or liquid Amies (n = 5) (sample provenance not disclosed, positive determination with CDC 2019-nCoV Diagnostic Panel),
2) 13 negative clinical OP specimens in either VTM (n = 5) or UTM (n = 8) (sample provenance not disclosed, positive determination with CDC 2019-nCoV Diagnostic Panel),
3) 1 negative clinical NP/OP specimen in VTM (sample provenance not disclosed, positive determination with CDC 2019-nCoV Diagnostic Panel),
4) 1 negative clinical Ns specimen in VTM (sample provenance not disclosed, positive determination with CDC 2019-nCoV Diagnostic Panel), and
5) 5 negative clinical NP specimens in either VTM (n = 3) or liquid Amies (n = 2) (sample provenance not disclosed, positive determination with CDC 2019-nCoV Diagnostic Panel).",included,included,included,ND,https://www.fda.gov/media/141496/download,https://www.fda.gov/media/141493/download,,,,,
,"DxTerity Diagnostics, Inc.",DxTerity SARS-CoV-2 RT-PCR Test,,https://dxterity.com/sars-cov-2-test-covid-19/,Lab,USA,"EUA granted August 21, 2020",Laboratory,H,Molecular,RNA,rRT-PCR,Sal,Spectrum Solutions LLC SDNA-1000 Saliva Collection Device,"N, S, ORF1ab",NA,Sera-Mag SpeedBeads Carboxyl Magnetic Beads on the ABI MagMax 96 Magnetic Particle Processor (software version 4.0),ABI ViiA 7 Real-Time PCR System (QuantStudio 5 software version 1.3),24 -48 hours for result from lab,50 copies/mL,,No cross-reactivity predicted in silico,97.20%,36,Clinical,92.50%,40,,,"PPA determined with 36 clinical positive saliva specimens from synmptomatic individuals either purchased from The MT Group (Van Nuys, CA) with samples collected in California and Florida or obtained at undisclosed testing clinics throughout the greater Los Angeles area and Phoenix, Arizona (number of samples from each source not disclosed; positive determination made with a paired NP sepcimen collected concurrently and tested using an undisclosed EUA authorized comparator). 
NPA determined with 40 clinical negative saliva specimens from synmptomatic individuals either purchased from The MT Group (Van Nuys, CA) with samples collected in California and Florida or obtained at undisclosed testing clinics throughout the greater Los Angeles area and Phoenix, Arizona (number of samples from each source not disclosed; negative determination made with a paired NP sepcimen collected concurrently and tested using an undisclosed EUA authorized comparator).",included,included,included,ND,https://www.fda.gov/media/141491/download,https://www.fda.gov/media/141488/download,,,,,
,"Guardant Health, Inc.",Guardant-19,,https://investors.guardanthealth.com/news-releases/news-release-details/guardant-health-receives-fda-emergency-use-authorization-its,Lab,USA,"EUA granted August 21, 2020",Laboratory,H,Molecular,RNA,"RT-PCR, NGS","NP swab, OP swab, Ns swab, ANs swab, MTNs swab, NP aspirate, NP wash, Ns aspirate, Ns wash",ND,N (N1),NA,"Zymo Quick-DNA/RNA Viral MagBead Kit on the Hamilton Star (Venus Software version 4.5.0.5217) for extraction, Zymo Quick-DNA/RNA Viral MagBead Kit on the Hamilton Starlet Liquid Handling Systems (Venus Software version 4.5.0.5217) for extraction, ABI Veriti Thermal Cycler (Firmware version 2.0.4) and Agilent 4200 Tapestation System (Tapestation software version 3.2) for RT-PCR and library generation","Illumina NextSeq 500 Instrument (NextSeq software version 4.0.1) , Illumina NextSeq 550 Instrument (NextSeq software version 4.0.1)",ND,0.125 copies/uL,,No cross-reactivity predicted in silico,95.52%,67,Clinical,98.33%,60,,,"PPA determined with 1) 37 positive remnant NP and OP swab specimens (number of each specimen type not disclosed) collected by healthcare providers from patients seeking SARS-CoV-2 testing over March and April 2020 in an undisclosed county (exact specimens provenance not disclosed, positive determination using undisclosed EUA-approved comparator test at an undisclosed laboratory within the county) and 2) 30 positive remnant NP swab specimens collected by healthcare providers from patients seeking SARS-CoV-2 testing over March and April 2020 in either a second undisclosed county or on an undisclosed cruise ship (exact specimen provenance not disclosed, positive determination using undisclosed EUA-approved comparator test at an undisclosed laboratory in the second county). 
NPA determined with 1) 30 negative remnant NP and OP swab specimens (number of each specimen type not disclosed) collected by healthcare providers from patients seeking SARS-CoV-2 testing over March and April 2020 in an undisclosed county (exact specimens provenance not disclosed, negative determination using undisclosed EUA-approved comparator test at an undisclosed laboratory within the county) and 2) 30 negative remnant NP swab specimens collected by healthcare providers from patients seeking SARS-CoV-2 testing over March and April 2020 in either a second undisclosed county or on an undisclosed cruise ship (exact specimen provenance not disclosed, negative determination using undisclosed EUA-approved comparator test at an undisclosed laboratory in the second county). 
",included,included,included,ND,https://www.fda.gov/media/141487/download,https://www.fda.gov/media/141484/download,,,,,
,"Beckman Coulter, Inc.",Access SARS-CoV-2 IgG,,https://www.beckmancoulter.com/products/immunoassay/access-sars-cov-2-igg-antibody-test,Kit,USA,"EUA granted June 26, 2020",Laboratory,"H, M",Serology,IgG,Heterogeneous Immunoassay (CLIA),"Ser, Pla","lithium heparin, dipotassium EDTA, tripotassium EDTA, sodium citrate, serum separating tube",NA,S1 (RBD),"Beckman Coulter Access 2 (software version not disclosed), Beckman Coulter UniCel DxI 600 (software version not disclosed), Beckman Coulter UniCel DxI 800 (software version not disclosed),  Beckman Coulter UniCel DxC 600i (software version not disclosed), Beckman Coulter UniCel DxC 680i (software version not disclosed), Beckman Coulter UniCel DxC 880i (software version not disclosed), Beckman Coulter UniCel DxC 660i (software version not disclosed), Beckman Coulter UniCel DxC 860i (software version not disclosed)","Beckman Coulter Access 2 (software version not disclosed), Beckman Coulter UniCel DxI 600 (software version not disclosed), Beckman Coulter UniCel DxI 800 (software version not disclosed),  Beckman Coulter UniCel DxC 600i (software version not disclosed), Beckman Coulter UniCel DxC 680i (software version not disclosed), Beckman Coulter UniCel DxC 880i (software version not disclosed), Beckman Coulter UniCel DxC 660i (software version not disclosed), Beckman Coulter UniCel DxC 860i (software version not disclosed)",~25 min,NA,,No cross-reactivity detected in wet lab testing,96.80%,95,Clinical,99.60%,1400,99.80%,93.50%,"PPA determined with 95 serum and plasma samples  (number of each specimen type not disclosed) from symptomatic individuals diagnosed with  PCR-confirmed SARS-CoV-2 infection from France and the United States (specimens provenance not disclosed, positive determination using an undisclosed PCR test).  Sensitivity for all 192 specimens stratified by days post PCR positive: 75.8% (0-7d post PCR positive, n=33), 95.3% (8-14d post PCR positive , n=64), 96.8% (>15d post PCR positive, n=95). NPA determined with 1) 1,000 samples from blood donors in France collected prior to December 2019, and 2) 400 samples from routine clinical laboratory diagnostic samples (type of samples not disclosed) in France (n = 200) and the United States (n = 200) collected prior to December 2019.  A  longitudinal seroconversion study was also conducted",not included,not included,not included,ND,https://www.fda.gov/media/139627/download,https://www.fda.gov/media/139624/download,,,,,
,LumiraDx UK Ltd.,LumiraDx SARS-CoV-2 Ag Test,,https://www.lumiradx.com/us-en/what-we-do/diagnostics/test-technology/antigen-test,Kit,UK,"EUA granted August 18, 2020","Laboratory, POC","H, M, W",Antigen,Antigen,Fluorescence immunoassay,Ns swab,NA,NA,N,LumiraDx Extraction Buffer,LumiraDx Instrument,12 minutes after sample loading,32 TCID50/mL,,No cross-reactivity detected in wet lab testing,97.60%,83,Clinical,96.60%,174,,,"PPA determined with 83 clinical positive Ns specimens (comparative positive determination conducted on a separate set of patient-matched Ns specimens collected concurrently into UTM and tested with an undisclosed EUA PCR method).   Positive results were also stratified by patient age and days since symptom onset. No positive results were observed from patients without symptoms or beyond 12 days of symptom onset. 
NPA determined with 174 clinical negative Ns specimens (comparative negative determination conducted on a separate set of patient-matched Ns specimens collected concurrently into UTM and tested with an undisclosed EUA PCR method).
A total of 257 specimens were collected from sequentially enrolled subjects who presented with symptoms of COVID-19 (n = 159) or key workers (n = 98) at increased risk of infection from five sites across the United States and one site in the United Kingdom.  No positive results were observed from patients without symptoms or beyond 12 days of symptom onset.",included,not included,included,ND,https://www.fda.gov/media/141304/download,https://www.fda.gov/media/141301/download,,,,,
,"ZhuHai Sinochips Bioscience Co., Ltd.",COVID-19 Nucleic Acid RT-PCR Test Kit ,,http://www.sinochips.cn/index.php/home/News/detail/id/175.html,Kit,China,"EUA granted August 17, 2020",Laboratory,H,Molecular,RNA,rRT-PCR,"Ns swab, MTNs swab, NP swab, OP swab, NP wash, NP aspirate, Ns aspirate","VTM for swabs, no preservatives should be added to NP wash or NP aspirate","ORF1ab, N",NA,"Qiagen QIAamp® Viral RNA Mini Kit (manual extraction), Thermo Fisher MagMAX Viral/Pathogen Nucleic Acid Isolation Kit on the Thermo Fisher KingFisher™ Flex Magnetic Particle Processor (automated extraction)","ABI 7500 Real-Time PCR system (7500 Software v2.3) for manual extraction of RNA, ABI 7500 Fast Dx Real-Time PCR Instrument (SDS Software v1.4.1) for automated extraction of RNA",ND,"2 copies/uL using Qiagen QIAamp® Viral RNA Mini Kit and ABI 7500 Real-Time PCR system (manual)
2.5 copies/uL using Thermo Fisher MagMax Viral/Pathogen Nucleic Acid Isolation kit and ABI 7500 Fast Dx Real-Time PCR system (automated)                                                                                                                                                                                            ",,No cross-reactivity predicted in silico nor detected in wet lab testing,96.5 %,85,Clinical,100.00%,310,,,"PPA determined with clinical specimens consisting of 85 positive NP swabs (specimens provenance not disclosed, positive determination using an undisclosed FDA EUA-authorized test)
NPA determined with clinical specimens consisting of 310 negative NP swabs (specimens provenance not disclosed, negative determination using an undisclosed FDA EUA-authorized test)                                                                                          PPA and NPA dtermined using Thermo Fisher MagMax Viral/Pathogen Nucleic Acid Isolation kit and ABI 7500 Fast Dx Real-Time PCR system (automated)   ",included,included,included,ND,https://www.fda.gov/media/141246/download,https://www.fda.gov/media/141243/download,,,,,
