Y,"CENTOGENE US, LLC",CentoFast-SARS-CoV-2 RT-PCR Assay,,https://www.centogene.com/covid-19/testing/about-the-sars-cov-2-test.html,Lab,USA,"EUA granted July 1, 2020",Laboratory,H,Molecular,RNA,rRT-PCR,OP Swab,Dry swab,"E, RdRP",NA,Macherey-Nagel NucleoMag VET Kit on the ThermoFisher KingFisher Flex,Roche LightCycler 480 II (Software Version 1.5.1.62 or higher),ND,5 copies/uL,,No cross-reactivity predicted in silico nor detected in wet lab testing,100.00%,30,Clinical,100.00%,30,,,PPA determined with 30 clinical blinded and randomized dry OP specimens (source not disclosed) confirmed to be positive with an undisclosed EUA RT-PCR test.  NPA determined with 30 clinical blinded and randomized dry OP specimens (source not disclosed) confirmed to be negative with an undisclosed EUA RT-PCR test.,included,included,included,ND,https://www.fda.gov/media/139725/download,https://www.fda.gov/media/139722/download,,,,,
Y,The Kroger Co.,Kroger Health COVID-19 Test Home Collection Kit,,https://www.krogerhealth.com/,Collection,USA,"EUA granted June 30, 2020",Laboratory,NA,Home Collection Kit,RNA,NA,Nasal swab,Saline,NA,NA,NA,NA,NA,NA,,NA,NA,NA,NA,NA,NA,0.00%,,NA - collection kit,NA,NA,NA,ND,https://www.fda.gov/media/139683/download,https://www.fda.gov/media/139681/download,,,,,
Y,"TNS Co., Ltd (Bio TNS)",COVID-19 RT-PCR Peptide Nucleic Acid (PNA) kit,,https://biotns.co.kr/index#COVID19,Kit,S. Korea,"EUA granted June 30, 2020",Laboratory,H,Molecular,RNA,rRT-PCR,"NP swab, OP swabs, ANs swab, MTNs swab, BAL, NP wash, NP aspirate, Ns aspirate","VTM, saline","RdRP, N",NA,Qiagen RNeasy Mini Kit,"Bio-Rad CFX-96 real-time PCR detection system with C1000 Thermal cycler (with CFX Manager v. 3.0 or v. 3.1 software or CFX Maestro software), ABI 7500/7500 Fast (software version 2.3)",ND,"3.715 copies/uL (N gene), 2.524 copies/uL (RdRP gene)",,No cross-reactivity predicted in silico nor detected in wet lab testing,100.00%,33,Clinical,100.00%,32,,,PPA determined with 33 archived clinical NP specimens from symptomatic patients suspected of COVID-19 infection and confirmed to be positive with the EUA authorized Seegene Allplex 2019-nCoV Assay.  NPA determined with 32 archived clinical NP specimens from symptomatic patients suspected of COVID-19 infection and confirmed to be negative with the EUA authorized Seegene Allplex 2019-nCoV Assay.,included,included,included,ND,https://www.fda.gov/media/139680/download,https://www.fda.gov/media/139677/download,,,,,
Y,"Psomagen, Inc.",Psoma COVID-19 RT Test,,https://psomagen.com/covid-test/,Lab,USA,"EUA granted June 30, 2020",Laboratory,H,Molecular,RNA,rRT-PCR,"Ns swab, MTNs swab, NP swab, OP swab, BAL",ND,"N (N1, N2)",NA,Takara Bio NucleoSpin RNA Virus Kit ,Roche Light cycler 480 instrument ( with software Version l.5.),ND,1 cp/µL,,No cross-reactivity predicted in silico nor detected in wet lab testing,100.00%,85,Clinical and contrived,100.00%,85,,,"PPA determined with 1) 30 contrived specimens spiked with SARS-CoV-2 RNA Isolate (BEI Resources, Cat # 52285) into negative clinical NP specimens (source of specimens and method of negative determination not disclosed) and 2) 55 clinical NP specimens (source not disclosed) confirmed to be positive with either the FDA EUA RT-PCR the TaqPath COVID-19 Method (EUA200010) or the LabCorp COVID-19 RT_PCR Test (EUA200011) (number of samples run with each comparator not disclosed). NPA determined with 1) 30 negative clinical NP specimens (source of specimens and method of negative determination not disclosed) and 2) 55 clinical NP specimens (source not disclosed) confirmed to be negative with either the FDA EUA RT-PCR the TaqPath COVID-19 Method (EUA200010) or the LabCorp COVID-19 RT_PCR Test (EUA200011) (number of samples run with each comparator not disclosed).",included,included,included,ND,https://www.fda.gov/media/139676/download,https://www.fda.gov/media/139673/download,,,,,
Y,"InBios International, Inc.",SCoV-2 Detect IgM ELISA,,https://inbios.com/scov-2-detect-igm-elisa-kit/,Kit,USA,"EUA granted June 30, 2020",Laboratory,H,Serology,IgM,ELISA,Serum,NA,NA,ND,Manual (with unspecified automated plate washer),Microplate reader (manufacturer not specified),~1 hour and 50 minutes after sample preparation,NA,,2/180 samples positive for normal human serum specimens (collected in the US prior to the COVID-19 outbreak) during wet lab testing,96.70%,30,Clinical,98.80%,80,99.80%,80.90%,"PPA determined from 120 serum specimens collected from 85 individuals who tested positive by SCoV-2 PCR assay (method not disclosed). Sensitivity for samples were further stratified into specific windows post symptom onset with PCR positive at any time (0-7d pso, 66.67%, n=9; 8-14d pso, 92.11%, n=38; >14d pso, 94.12%, n=51; unknown, 100.00%, n=22). NPA determined using 95 normal human serum specimens (source and method of negative determination not disclosed).  As part of cross-reactivity studies, also reported results from testing 180 normal human serum samples collected in the US prior to the COVID-19 outbreak (2/180 reactive).  Also conducted reproducibility tests on positive and negative serum samples assayed by three trained operators on three different days in triplicate (n = 27 total runs per sample), showing 100% positive or negative agreement between runs for each positive and negative sample, respectively.",not included,included,included,ND,https://www.fda.gov/media/139730/download,https://www.fda.gov/media/139726/download,,,,,
Y,LifeHope Labs,LifeHope 2019-nCoV Real-Time RT-PCR Diagnostic Panel,,https://www.lifehopetestkit.com/,Lab,USA,"EUA granted June 29, 2020",Laboratory,H,Molecular,RNA,rRT-PCR,"Ns swab, MTNs swab, NP swab, OP swab, BAL",ND,"N (N1, N2)",NA,Indical IndiMag Extraction Kit ,ABI QuantStudio 5 (software version 1.5.1),ND,2.5 GE/µL ,,No cross-reactivity predicted in silico nor detected in wet lab testing,100.00%,30,Clinical,100.00%,30,,,PPA determined with 30 clinical NP specimens (source not disclosed) confirmed to be positive with the CDC 2019-Novel Coronavirus (2019-nCoV) Real_Time RT-PCR Diagnostic Panel.  NPA determined with 30 clinical NP specimens (source not disclosed) confirmed to be negative with the CDC 2019-nCoV Real_Time RT-PCR Diagnostic Panel.,included,included,included,ND,https://www.fda.gov/media/139623/download,https://www.fda.gov/media/139620/download,,,,,
Y,"Acupath Laboratories, Inc.",Acupath COVID-19 Real-Time (RT-PCR) Assay,,https://www.acupath.com/covid-19-testing/,Lab,USA,"EUA granted June 29, 2020",Laboratory,H,Molecular,RNA,rRT-PCR,"NP swab, NP aspirate, BAL",ND,"Orf1ab, N, S",NA,ThermoFisher MagMAX Viral/Pathogen Nucleic Acid Isolation Kit using the ThermoFisher KingFisher Flex Purification System,ABI QuantStudio 12K Flex Real-Time PCR (with QuantStudio software version 1.4.),ND,25 copies/uL,,No cross-reactivity predicted in silico nor detected in wet lab testing,100.00%,30,Clinical,100.00%,30,,,PPA determined with 30 clinical NP specimens (source not disclosed) confirmed to be positive with the EUA-authorized Cepheid Xpert Xpress SARS-CoV-2 assay.  NPA determined with 30 clinical NP specimens (source not disclosed) confirmed to be negative with the EUA-authorized Cepheid Xpert Xpress SARS-CoV-2 assay.,included,included,included,ND,https://www.fda.gov/media/139672/download,https://www.fda.gov/media/139669/download,,,,,
,,,,,,,,,,,,,,,,,,,,,,,,,,,,,,,,,,,,,,,,,
Y,"Inform Diagnostics, Inc.",Inform Diagnostics SARS-CoV-2 RT-PCR Assay,,https://www.informdx.com/Our-Services/Hematopathology/COVID-19-Testing.aspx,Lab,USA,"EUA granted June 26, 2020",Laboratory,H,Molecular,RNA,rRT-PCR,"NP swab, OP swab, ANs swab, MTNs swab, NP wash, NP aspirate, Ns aspirate, BAL",ND,"N (N1, N2)",NA,ViralXpress DNA/RNA Extraction Reagent (Qiagen QIAgility for additional sample prep),"ABI 7500 Fast Dx Real-Time PCR Instrument (software version 1.4), ABI QuantStudio (software version 1.0.3)",ND,20 copies/uL,,No cross-reactivity predicted in silico,97.03%,131,Clinical and contrived,100.00%,127,,,"PPA determined with 1) 33 clinical NP and OP specimens (source and number of each specimen type not disclosed) confirmed positive with an unmodified CDC EUA Authorized Assay and tested with assay under evaluation using two different detection methods: the ABI7500 Fast System (n = 33) and the ABI QuantStudio (n = 33) 2) 5 specimens (source and type not disclosed) confirmed positive with the CDC EUA assay by the Arizona Health Department (detection method for assay under evaluation not disclosed), and 3) 30 blinded and randomized contrived specimens spiked with synthetic viral RNA provided from Twist Bioscience (catalog number not disclosed) into negative clinical NP specimens (source of specimens not disclosed) determined negative with the unmodified CDC EUA Authorized Assay and tested with assay under evaluation using two different detection methods: the ABI7500 Fast System (n = 30) and the ABI QuantStudio (n = 30). Note that it is not disclosed whether the 5 specimens evaluated by the Arizona Health Department were from a specimen set mutually exlusive from those used in other validation experiments.  NPA determined with 1) 31 clinical NP and OP specimens (source and number of each specimen type not disclosed) confirmed negative with an unmodified CDC EUA Authorized Assay and tested with assay under evaluation using two different detection methods: the ABI7500 Fast System (n = 31) and the ABI QuantStudio (n = 31) 2) 5 specimens (source and type not disclosed) confirmed negative with the CDC EUA assay by the Arizona Health Department (detection method for assay under evaluation not disclosed), and 3) 30 blinded and randomized negative clinical NP specimens (source of specimens and method of negative determination not disclosed) and tested with assay under evaluation using two different detection methods: the ABI7500 Fast System (n = 30) and the ABI QuantStudio (n = 30). Note that it is not disclosed whether the 5 specimens evaluated by the Arizona Health Department were from a specimen set mutually exlusive from those used in other validation experiments.  An additional sample was excluded due to an indeterminate result with both detection methods based on the reporting strategy for the original CDC EUA authorization.",included,included,included,ND,https://www.fda.gov/media/139572/download,https://www.fda.gov/media/139569/download,,,,,
Y,"PlexBio Co., Ltd",IntelliPlex SARS-CoV-2 Detection Kit,,https://www.plexbio.com/intelliplex%E2%84%A2-sars-cov-2-detection-kit,Kit,Taiwan,"EUA granted June 25, 2020",Laboratory,H,Molecular,RNA,rRT-PCR/πCode,"NP swab, OP swab, ANs swab, MTNs swab, NP wash, NP aspirate, Ns aspirate, BAL","VTM, saline","RdRP, E, N",NA,QIAamp Viral RNA Mini Kit (as well as the Thermo Fisher MiniAmp Thermal cycler for amplication and the PlexBio IntelliPlex 1000 πCode Processor for hybridization),PlexBio 100 Fluorescent Analyzer (with DeXipher MD software),~4.5 hours (including sample prep),140 copies/mL,,"In silico analysis showed homologies >80% to Human coronavirus OC43 and Human coronavirus HKUI for RdRP probe, forward primer, and reverse primer. No cross reactivity detected in wet testing.",100.00%,35,Clinical and contrived,100.00%,30,,,"PPA determined with 30 blinded and randomized contrived specimens spiked with SARS-CoV-2 Reference Material (SeraCare; AccuPlex™ SARS-CoV-2 Reference Material Kit, Cat. No. 0505-0126) into individual, unique negative clinical NP specimens (source of specimens and method of negative determination not disclosed) and with 5 clinical NP specimens confirmed to be positive with the EUA authorized Hologic Panther Fusion SARS-CoV-2 Assay. NPA determined with 30 blinded and randomized negative clinical NP specimens (source of specimens and method of negative determination not disclosed).",included,included,included,ND,https://www.fda.gov/media/139527/download,https://www.fda.gov/media/139528/download,,,,,
Y,PreciGenome LLC,FastPlex Triplex SARS-CoV-2 detection kit (RT-Digital PCR),,https://www.precigenome.com/coronavirus-covid19-pcr-assay,Kit,USA,"EUA granted June 25, 2020",Laboratory,H,Molecular,RNA,RT-dPCR,OP swab,"VTM, UTM","Orf1ab, N",NA,QIAamp Viral RNA Mini Kit,DropX-2000 Digital PCR System (with GeneCount Software V1.61.0508),ND,571.4 copies/mL (8 copies/rxn),,No cross-reactivity predicted in silico nor detected in wet lab testing,96.30%,108,Clinical,96.67%,60,,,PPA determined with 108 randomized and blinded clinical OP specimens collected by qualified personnel (source not disclosed) and confirmed to be positive with an undisclosed EUA authorized RT-PCR test for use with upper respiratory specimens run using the ABI 7500 per comparator instructions.  NPA determined with 60 randomized and blinded clinical OP specimens collected by qualified personnel (source not disclosed) and confirmed to be negative with an undisclosed EUA authorized RT-PCR test for use with upper respiratory specimens run using the ABI 7500 per comparator instructions.  Two additional samples were excluded due to an invalid test result.,included,included,included,ND,https://www.fda.gov/media/139523/download,https://www.fda.gov/media/139524/download,,,,,
Y,"Diagnostic Solutions Laboratory, LLC",DSL COVID-19 Assay,,https://www.diagnosticsolutionslab.com/tests/covid-19-sars-cov-2,Lab,USA,"EUA granted June 25, 2020",Laboratory,H,Molecular,RNA,rRT-PCR,"NP swab, OP swab, Ns swab, MTN swab, BAL","Dry swab, VTM","N (N1, N3), S",NA,Omega BioTek MagBind Viral DNA/RNA 96 Kit on the ThermoFisher Scientific KingFisher Flex Purification System,ABI QuantStudio 5 Real-Time PCR System (QuantStudio Analysis software version 1.5.1),ND,10 copies/swab,,No cross-reactivity predicted in silico nor detected in wet lab testing,100.00%,29,Clinical,97.00%,33,,,"PPA determined with 29 dry clinical NP specimens (source not disclosed) confirmed to be positive with an undisclosed FDA EUA authorized SARS-CoV-2 PCR test with three targets (ORF1ab, S and N).  NPA determined with 33 dry clinical NP specimens (source not disclosed) confirmed to be negative with an undisclosed FDA EUA authorized SARS-CoV-2 PCR test with three targets (ORF1ab, S and N).  Two additional samples were run and considerend inconclusive by the comparator assay. Note that for both PPA and NPA, the same extraction products from the clinical specimens were tested with both the comparator assay and the assay under evaluation.  ",included,included,included,ND,https://www.fda.gov/media/139516/download,https://www.fda.gov/media/139513/download,,,,,
Y,"University of Texas MD Anderson Cancer Center, Molecular Diagnostics Laboratory",MD Anderson High-throughput SARS-CoV-2 RT-PCR Assay,,https://www.mdanderson.org/patients-family/becoming-our-patient/planning-for-care/coronavirus-protections.html,Lab,USA,"EUA granted June 24, 2020",Laboratory,H,Molecular,RNA,rRT-PCR,"NP swab, OP swab, Ns swab, MTN swab",ND,"N (N1, N2)",NA,"Promega Maxwell HT Viral TNA Kit (manual),  Promega Maxwell HT Viral TNA Kit on the Hamilton Robotics MicroLab Star, Promega Maxwell HT Viral TNA Kit on the Hamilton Robotics MicroLab Starlet (additional sample prep with the Hamilton Robotics MicroLab Star), undisclosed extraction kit on the Promega Maxwell RSC 48","ABI QuantStudio 7 Flex Fast Sequence Detection System (software version 1.3), ABI 7500 Fast Real-Time PCR Instrument (software version 1.5.1), ABI QuantStudio Dx Real-Time PCR Instrument with 96-well fast block (software version 1.0.3)",ND,"1.67 copies/uL with manual extraction using Promega Maxwell HT Viral TNA Kit and detection with ABI QuantStudio 7 Flex Fast Sequence Detection System;  
5 copies/uL with extraction using Promega Maxwell HT Viral TNA Kit on the Hamilton Robotics MicroLab Starlet and detection with ABI QuantStudio 7 Flex Fast Sequence Detection System;
5 copies/uL with extraction using Promega Maxwell HT Viral TNA Kit on the Hamilton Robotics MicroLab Star and detection with ABI QuantStudio 7 Flex Fast Sequence Detection System;
5 copies/uL with extraction using Promega Maxwell HT Viral TNA Kit on the Hamilton Robotics MicroLab Starlet and detection with ABI 7500 Fast Real-Time PCR Instrument;
5 copies/uL with extraction using Promega Maxwell HT Viral TNA Kit on the Hamilton Robotics MicroLab Starlet and detection with ABI QuantStudio Dx Real-Time PCR Instrument with 96-well fast block;",,No cross-reactivity predicted in silico nor detected in wet lab testing,100.00%,31,Clinical,100.00%,28,,,"PPA determined with 26 individual clinical NP specimens collected at MD Anderson and confirmed to be positive with an undisclosed FDA Emergency Use Authorized (EUA) assay by MD Anderson, and with 5 clinical NP specimens collected at MD Anderson and confirmed to be positive with undisclosed FDA Emergency Use Authorized (EUA) assay by the Houston Health Department Laboratory.  NPA determined with 22 individual clinical NP specimens collected at MD Anderson and confirmed to be neegative with an undisclosed FDA Emergency Use Authorized (EUA) assay by MD Anderson, and with 6 clinical NP specimens collected at MD Anderson and confirmed to be negative with undisclosed FDA Emergency Use Authorized (EUA) assay by the Houston Health Department Laboratory.  All specimens for the assay under evaluation were processed with manual extraction using the Promega Maxwell HT Viral TNA Kit and detection with the ABI QuantStudio 7 Flex Fast Sequence Detection System",included,included,included,ND,https://www.fda.gov/media/139512/download,https://www.fda.gov/media/139509/download,,,,,
Y,"Gencurix, Inc.",GenePro SARS-CoV-2 Test,,http://www.gencurix.com/eng/sub_2_6.php,Kit,South Korea,"EUA granted June 23, 2020",Laboratory,H,Molecular,RNA,rRT-PCR,"NP swab, OP swab, AN swab, MTN swab, NP wash, NP aspirate, Ns aspirate, BAL",UTM or equivalent,"Orf1ab, E",NA,"Qiagen QIAamp Viral RNA Mini Kit (manual), Qiagen QIAamp DSP Viral RNA Mini Kit (manual),
Qiagen QIAamp Viral RNA Mini Kit on the Qiagen QIAcubeConnnect, 
Qiagen QIAamp DSP Viral RNA Mini Kit on the Qiagen QIAcubeConnect,
Thermo Fisher Scientific MagMAX Viral/Pathogen Nucleic Acid Isolation Kit on the Thermo Fisher Scientific KingFisher Flex System ","ABI QuantStudio Dx Real-Time PCR Instrument (software version 1.0.3), Bio-Rad CFX9 Dx System (software version 3.1)",ND,"5550 GE/mL (777 GE/140 uL, 71 GE/rxn) for Orf1ab gene and 6000 GE/mL (840 GE/140 µL, 77 GE/rxn) for E gene with manual extraction using QIAamp Viral RNA Mini Kit and detection with ABI QuantStudioDx;  
6000 GE/mL (840 GE/140 µL, 77 GE/rxn) for both targets with manual extraction using QIAamp Viral RNA Mini Kit and detection with Bio-Rad CFX9 Dx System;
6000 GE/mL (840 GE/140 µL, 77 GE/rxn) for both targets with extraction using MagMAX Viral/Pathogen RNA Isolate Kit on the Thermo Fisher Scientific KingFisher Flex System and detection with ABI QuantStudioDx ",,No cross-reactivity predicted in silico,100.00%,100,Contrived,100.00%,90,,,"PPA determined with contrived specimens spiked with heat inactivated SARS-CoV-2 provided from BEI Resources (Cat. No. NR-52286, lot number 70033548) into unique negative clinical NP specimens (source of specimens and method of negative determination not disclosed) and tested with assay under evaluation with three combinations of extraction and detection methods: manual extraction with Qiagen QIAamp Viral RNA Mini Kit (QIAamp) and detection with ABI QuantStudio Dx (QSDx) (n = 30), manual extraction with QIAamp and detection with Bio-Rad CFX9 Dx System (n = 30), and extraction with MagMAX Viral/Pathogen Nucleic Acids Isolation Kit on the KingFisher Flex System and detection with QSDx (n=40). Note that it is not disclosed whether the specimens evaluated for each method combination were from mutually exlusive specimen sets.  NPA determined with unique negative clinical NP specimens (source of specimens and method of negative determination not disclosed) and tested with assay under evaluation with three combinations of extraction and detection methods: manual extraction with Qiagen QIAamp Viral RNA Mini Kit (QIAamp) and detection with ABI QuantStudio Dx (QSDx) (n = 30), manual extraction with QIAamp and detection with Bio-Rad CFX9 Dx System (n = 30), and extraction with MagMAX Viral/Pathogen Nucleic Acids Isolation Kit on the KingFisher Flex System and detection with QSDx (n=30). Note that it is not disclosed whether the specimens evaluated for each method combination were from mutually exlusive specimen sets",not included,included,included,ND,https://www.fda.gov/media/139442/download,https://www.fda.gov/media/139443/download,,,,,
Y,University of Alabama at Birmingham Fungal Reference Lab,FRL SARS CoV-2 Test,,https://npidb.org/organizations/laboratories/clinical-medical-laboratory_291u00000x/1891980934.aspx,Lab,USA,"EUA granted June 23, 2020",Laboratory,H,Molecular,RNA,rRT-PCR,"NP swab, OP swab, Ns swab, AN swab, MTN swab, NP wash, NP aspirate, Ns aspirate, BAL",ND,N (N1),NA,Omega Scientific E.Z.N.A. Viral RNA Kit,ABI QuantStudio 5 Real-Time PCR System (Software version V1.4.3),ND,125 copies/mL,,No cross-reactivity predicted in silico,100.00%,35,Clinical,100.00%,35,,,"PPA determined with 30 clinical NP specimens (source not disclosed) confirmed to be positive with an undisclosed EUA sanctioned SARS-CoV-2 real-time RT-PCR assay, and 5 NP specimens (source not disclosed) confirmed to be positive with an undisclosed EUA sanctioned SARS-CoV-2 real-time RT-PCR assay by an undisclosed high complexity CLIA laboratory. Note that it is not disclosed whether the latter 5 specimens were from a specimen set that was mutually exlusive from the others reported.  NPA determined with 30 clinical NP specimens (source not disclosed) confirmed to be negative with an undisclosed EUA sanctioned SARS-CoV-2 real-time RT-PCR assay, and 5 NP specimens (source not disclosed) confirmed to be negative with an undisclosed EUA sanctioned SARS-CoV-2 real-time RT-PCR assay by an undisclosed high complexity CLIA laboratory. Note that it is not disclosed whether the latter 5 specimens were from a specimen set that was mutually exlusive from the others reported.",included,included,included,ND,https://www.fda.gov/media/139437/download,https://www.fda.gov/media/139439/download,,,,,
Y,HealthQuest Esoterics,HealthQuest Esoterics TaqPath SARS-CoV-2 Assay,,https://www.hqesoterics.com/covid-19,Lab,USA,"EUA granted June 23, 2020",Laboratory,H,Molecular,RNA,rRT-PCR,"NP swab, OP swab, AN swab, MTN swab, NP wash, NP aspirate, Ns aspirate, BAL","ClearPrep Specimen Transport Medium, UTM, VTM, Saline, PBS","Orf1ab, N, S",NA,Perkin Elmer Chemagic Viral DNA/RNA 300 Kit H96 on the Chemagic 360 extraction instrument software version 6.3.0.3. (with additional sample prep on the Janus G3 workstation (software 5.5.48)),QuantStudio 12K Flex Real-Time PCR System software version 1.3.,ND,20 copies/mL,,No cross-reactivity predicted in silico,100.00%,115,Clinical and contrived,100.00%,73,,,"PPA determined with 75 blinded and randomized contrived specimens spiked with SARS-CoV-2 targeted RNA fragments (ThermoFisher; TaqPath COVID-19 Positive Control) into negative clinical NP specimens (source of specimens and method of negative determination not disclosed), 35 clinical NP specimens (source not disclosed) confirmed to be positive with the CDC 2019-CoV Real-Time RT-PCR Diagnostic Panel by the Orange County Health Department, and 5 clinical NP specimens (source not disclosed) confirmed to be positive with the CDC 2019-CoV Real-Time RT-PCR Diagnostic Panel by Vitae Laboratories. Note that it is not disclosed whether the latter 5 specimens were from a specimen set that was mutually exlusive from the others reported.  NPA determined with 34 blinded and randomized negative clinical NP specimens (source of specimens and method of negative determination not disclosed), 34 clinical NP specimens (source not disclosed) confirmed to be negative with the CDC 2019-CoV Real-Time RT-PCR Diagnostic Panel by the Orange County Health Department, and 5 clinical NP specimens (source not disclosed) confirmed to be negative with the CDC 2019-CoV Real-Time RT-PCR Diagnostic Panel by Vitae Laboratories. Note that it is not disclosed whether the latter 5 specimens were from a specimen set that was mutually exlusive from the others reported.",included,included,included,ND,https://www.fda.gov/media/139434/download,https://www.fda.gov/media/139449/download,,,,,
